concept_id	concept_name	domain_id	vocabulary_id	concept_class_id	standard_concept	concept_code	valid_start_date	valid_end_date	invalid_reason
2000005021	Bavaria (partial inpatient, per day)	Observation	Inpatient charge	INP charge Hierarchy	<null>	OMOP6000376	1970-01-01	2099-12-31	<null>
2000005022	Bavaria: Day clinic geriatrics	Observation	Inpatient charge	INP charge code	<null>	85090001	1970-01-01	2099-12-31	<null>
2000005023	Bavaria: Day clinic pediatrics	Observation	Inpatient charge	INP charge code	<null>	85090002	1970-01-01	2099-12-31	<null>
2000005024	Bavaria: Partial inpatient skin day clinic	Observation	Inpatient charge	INP charge code	<null>	85090006	1970-01-01	2099-12-31	<null>
2000005025	Bavaria: Partial inpatient ENT clinic	Observation	Inpatient charge	INP charge code	<null>	85090007	1970-01-01	2099-12-31	<null>
2000005026	Bavaria: Day clinic hematology and internal oncology	Observation	Inpatient charge	INP charge code	<null>	85090008	1970-01-01	2099-12-31	<null>
2000005027	Bavaria: Day clinic pain therapy	Observation	Inpatient charge	INP charge code	<null>	85090009	1970-01-01	2099-12-31	<null>
2000005028	Bavaria: Partial inpatient pediatric surgery	Observation	Inpatient charge	INP charge code	<null>	85090010	1970-01-01	2099-12-31	<null>
2000005029	Bavaria: Partial inpatient treatment of patients requiring oncological treatment	Observation	Inpatient charge	INP charge code	<null>	85090011	1970-01-01	2099-12-31	<null>
2000005030	Bavaria: Partial inpatient diabetes treatment	Observation	Inpatient charge	INP charge code	<null>	85090012	1970-01-01	2099-12-31	<null>
2000005031	Bavaria: Partial inpatient treatment of oncological patients, children	Observation	Inpatient charge	INP charge code	<null>	85090013	1970-01-01	2099-12-31	<null>
2000005032	Bavaria: Day clinicv neurology 	Observation	Inpatient charge	INP charge code	<null>	85090014	1970-01-01	2099-12-31	<null>
2000005033	Bavaria: Day clinic diabetology/endocrinology	Observation	Inpatient charge	INP charge code	<null>	85090015	1970-01-01	2099-12-31	<null>
2000005034	Bavaria: Day clinic general surgery	Observation	Inpatient charge	INP charge code	<null>	85090017	1970-01-01	2099-12-31	<null>
2000005035	Bavaria: Day Clinic women's clinic	Observation	Inpatient charge	INP charge code	<null>	85090018	1970-01-01	2099-12-31	<null>
2000005036	Bavaria: Day clinic nuclear medicine	Observation	Inpatient charge	INP charge code	<null>	85090019	1970-01-01	2099-12-31	<null>
2000005037	Bavaria: Day clinic radiation medicine	Observation	Inpatient charge	INP charge code	<null>	85090020	1970-01-01	2099-12-31	<null>
2000005038	Bavaria: Day clinic dentistry, oral and maxillofacial surgery	Observation	Inpatient charge	INP charge code	<null>	85090021	1970-01-01	2099-12-31	<null>
2000005039	Bavaria: Day clinic rheumatism 	Observation	Inpatient charge	INP charge code	<null>	85090022	1970-01-01	2099-12-31	<null>
2000005040	Bavaria: Day clinic cardiology	Observation	Inpatient charge	INP charge code	<null>	85090024	1970-01-01	2099-12-31	<null>
2000005041	Bavaria: Day clinic gastroenterology 	Observation	Inpatient charge	INP charge code	<null>	85090025	1970-01-01	2099-12-31	<null>
2000005042	Bavaria: Day clinic hematology	Observation	Inpatient charge	INP charge code	<null>	85090026	1970-01-01	2099-12-31	<null>
2000005043	Bavaria: Day clinic vascular surgery	Observation	Inpatient charge	INP charge code	<null>	85090027	1970-01-01	2099-12-31	<null>
2000005044	Bavaria: Day clinic gynecology/obstetrics	Observation	Inpatient charge	INP charge code	<null>	85090028	1970-01-01	2099-12-31	<null>
2000005045	Bavaria: Day clinic oncology/chemotherapy	Observation	Inpatient charge	INP charge code	<null>	85090029	1970-01-01	2099-12-31	<null>
2000005046	Bavaria: Partial inpatient phoniatrics	Observation	Inpatient charge	INP charge code	<null>	85090030	1970-01-01	2099-12-31	<null>
2000005047	Bavaria: Partial inpatient cardiac surgery	Observation	Inpatient charge	INP charge code	<null>	85090031	1970-01-01	2099-12-31	<null>
2000005048	Bavaria: Day clinic severely craniocerebral injured patients	Observation	Inpatient charge	INP charge code	<null>	85090032	1970-01-01	2099-12-31	<null>
2000005049	Bavaria: Day clinic internal acute medicine	Observation	Inpatient charge	INP charge code	<null>	85090033	1970-01-01	2099-12-31	<null>
2000005050	Bavaria: Day clinic women's hospital (oncology)	Observation	Inpatient charge	INP charge code	<null>	85090035	1970-01-01	2099-12-31	<null>
2000005051	Bavaria: Day clinic radiation medicine (oncology)	Observation	Inpatient charge	INP charge code	<null>	85090036	1970-01-01	2099-12-31	<null>
2000005052	Bavaria: Partial inpatient internal medicine	Observation	Inpatient charge	INP charge code	<null>	85090037	1970-01-01	2099-12-31	<null>
2000005053	Bavaria: Partial inpatient center for vascular diseases and chronic problem wounds	Observation	Inpatient charge	INP charge code	<null>	85090039	1970-01-01	2099-12-31	<null>
2000005054	Bavaria: Day clinic ophthalmology	Observation	Inpatient charge	INP charge code	<null>	85090040	1970-01-01	2099-12-31	<null>
2000005055	Bavaria: Day clinic neurology, neuromuscular treatment unit	Observation	Inpatient charge	INP charge code	<null>	85090041	1970-01-01	2099-12-31	<null>
2000005056	Bavaria: Day clinic dentistry, oral and maxillofacial surgery	Observation	Inpatient charge	INP charge code	<null>	85090042	1970-01-01	2099-12-31	<null>
2000005057	Bavaria: Day clinic physical medicine	Observation	Inpatient charge	INP charge code	<null>	85090043	1970-01-01	2099-12-31	<null>
2000005058	Bavaria: Day clinic plasmapheresis 	Observation	Inpatient charge	INP charge code	<null>	85090044	1970-01-01	2099-12-31	<null>
2000005059	Bavaria: Partial inpatient ESWL	Observation	Inpatient charge	INP charge code	<null>	85090050	1970-01-01	2099-12-31	<null>
2000005060	Bavaria: Partial inpatient treatment with imaging diagnostics (only with OPS 3-200, 3-201, 3-202, 3-206, 3-207, 3-208, 3-20x, 3-220, 3-221, 3-222, 3-225, 3-226, 3-228, 3-22x, 3-800, 3-801, 3-803, 3-804, 3-805, 3-808, 3-809, 3-80x, 3-820, 3-821, 3-822, 3-824, 3-825, 3-828, 3-82a, 3-82x, 3-601, 3-602, 3-603, 3-604, 3-605, 3-606, 3-607, 3-60x)	Observation	Inpatient charge	INP charge code	<null>	85090051	1970-01-01	2099-12-31	<null>
2000005061	Bavaria: Day clinic nephrology	Observation	Inpatient charge	INP charge code	<null>	85090052	1970-01-01	2099-12-31	<null>
2000005062	Bavaria: Cystic fibrosis day clinic	Observation	Inpatient charge	INP charge code	<null>	85090053	1970-01-01	2099-12-31	<null>
2000005063	Bavaria: Day clinic ENT	Observation	Inpatient charge	INP charge code	<null>	85090054	1970-01-01	2099-12-31	<null>
2000005064	Bavaria: Partial inpatient service staging complex treatment	Observation	Inpatient charge	INP charge code	<null>	85090055	1970-01-01	2099-12-31	<null>
2000005065	Bavaria: Partial inpatient service vacuum biopsy	Observation	Inpatient charge	INP charge code	<null>	85090056	1970-01-01	2099-12-31	<null>
2000005066	Bavaria: Partial inpatient minimally invasive breast diagnostics (MIM)	Observation	Inpatient charge	INP charge code	<null>	85090057	1970-01-01	2099-12-31	<null>
2000005067	Bayern: Teilstationär TCE PÄD/ERW	Observation	Inpatient charge	INP charge code	<null>	85090058	1970-01-01	2099-12-31	<null>
2000005068	Bavaria: Partial inpatient TCE PÄD/ERW	Observation	Inpatient charge	INP charge code	<null>	85090059	1970-01-01	2099-12-31	<null>
2000005069	Bavaria: Partial inpatient stem cell collection from autologous donor	Observation	Inpatient charge	INP charge code	<null>	85090060	1970-01-01	2099-12-31	<null>
2000005070	Bavaria: Partial inpatient internal medicine, transfusion medicine	Observation	Inpatient charge	INP charge code	<null>	85090061	1970-01-01	2099-12-31	<null>
2000005071	Bavaria: Partial inpatient regional deep hyperthermia	Observation	Inpatient charge	INP charge code	<null>	85090063	1970-01-01	2099-12-31	<null>
2000005072	Bavaria: Partial body hyperthermia	Observation	Inpatient charge	INP charge code	<null>	85090064	1970-01-01	2099-12-31	<null>
2000005073	Bavaria: Partial inpatient skin day clinic, oncology	Observation	Inpatient charge	INP charge code	<null>	85090065	1970-01-01	2099-12-31	<null>
2000005074	Bavaria: Partial inpatient ENT main department	Observation	Inpatient charge	INP charge code	<null>	85090067	1970-01-01	2099-12-31	<null>
2000005075	Bavaria: Partial inpatient sleep laboratory, diagnostic night	Observation	Inpatient charge	INP charge code	<null>	85090068	1970-01-01	2099-12-31	<null>
2000005076	Bavaria: Partial inpatient sleep laboratory, therapeutic night	Observation	Inpatient charge	INP charge code	<null>	85090069	1970-01-01	2099-12-31	<null>
2000005077	Bavaria: Partial inpatient first-night-effect polysomnography without meaningful results	Observation	Inpatient charge	INP charge code	<null>	85090070	1970-01-01	2099-12-31	<null>
2000005078	Bavaria: Partial inpatient polysomnography	Observation	Inpatient charge	INP charge code	<null>	85090071	1970-01-01	2099-12-31	<null>
2000005079	Bavaria: Partial inpatient extended polysomnography	Observation	Inpatient charge	INP charge code	<null>	85090072	1970-01-01	2099-12-31	<null>
2000005080	Bavaria: Partial inpatient control examination polysomnography	Observation	Inpatient charge	INP charge code	<null>	85090073	1970-01-01	2099-12-31	<null>
2000005081	Bavaria: Rheumatism day clinic in connection with ZE 25.10	Observation	Inpatient charge	INP charge code	<null>	85090074	1970-01-01	2099-12-31	<null>
2000005082	Bavaria: Day clinic radiation medicine, brachytherapy	Observation	Inpatient charge	INP charge code	<null>	85090075	1970-01-01	2099-12-31	<null>
2000005083	Saarland (partial inpatient, per day)	Observation	Inpatient charge	INP charge Hierarchy	<null>	OMOP6000377	1970-01-01	2099-12-31	<null>
2000005084	Saarland: Partial inpatient oncology	Observation	Inpatient charge	INP charge code	<null>	85100001	1970-01-01	2099-12-31	<null>
2000005085	Saarland: Day clinic internal medicine	Observation	Inpatient charge	INP charge code	<null>	85100003	1970-01-01	2099-12-31	<null>
2000005086	Saarland: Partial inpatient LDL apheresis	Observation	Inpatient charge	INP charge code	<null>	85100004	1970-01-01	2099-12-31	<null>
2000005087	Saarland: Day clinic follow-up care of patients with cochlear implants	Observation	Inpatient charge	INP charge code	<null>	85100006	1970-01-01	2099-12-31	<null>
2000005088	Saarland: Day clinic shunt surgery	Observation	Inpatient charge	INP charge code	<null>	85100007	1970-01-01	2099-12-31	<null>
2000005089	Berlin (partial inpatient, per day)	Observation	Inpatient charge	INP charge Hierarchy	<null>	OMOP6000378	1970-01-01	2099-12-31	<null>
2000005090	Berlin: Partial inpatient chemotherapy, children	Observation	Inpatient charge	INP charge code	<null>	85110001	1970-01-01	2099-12-31	<null>
2000005091	Berlin: Partial inpatient HIV day clinic, adults	Observation	Inpatient charge	INP charge code	<null>	85110002	1970-01-01	2099-12-31	<null>
2000005092	Berlin: Partial inpatient HIV day clinic, children	Observation	Inpatient charge	INP charge code	<null>	85110003	1970-01-01	2099-12-31	<null>
2000005093	Berlin: Partial inpatient LDL apheresis	Observation	Inpatient charge	INP charge code	<null>	85110004	1970-01-01	2099-12-31	<null>
2000005094	Berlin: Partial inpatient day clinic metabolic diseases	Observation	Inpatient charge	INP charge code	<null>	85110005	1970-01-01	2099-12-31	<null>
2000005095	Berlin: Partial dialysis, children	Observation	Inpatient charge	INP charge code	<null>	85110007	1970-01-01	2099-12-31	<null>
2000005096	Berlin: Partial inpatient oncology day clinic	Observation	Inpatient charge	INP charge code	<null>	85110008	1970-01-01	2099-12-31	<null>
2000005097	Berlin: Partial inpatient day clinic rheumatological diseases	Observation	Inpatient charge	INP charge code	<null>	85110009	1970-01-01	2099-12-31	<null>
2000005098	Berlin: Partial inpatient dermatological day clinic	Observation	Inpatient charge	INP charge code	<null>	85110010	1970-01-01	2099-12-31	<null>
2000005099	Berlin: Partial inpatient geriatrics	Observation	Inpatient charge	INP charge code	<null>	85110011	1970-01-01	2099-12-31	<null>
2000005100	Berlin: Partial inpatient dialysis	Observation	Inpatient charge	INP charge code	<null>	85110012	1970-01-01	2099-12-31	<null>
2000005101	Berlin: Partial inpatient gynecology	Observation	Inpatient charge	INP charge code	<null>	85110013	1970-01-01	2099-12-31	<null>
2000005102	Berlin: Partial inpatient hematology	Observation	Inpatient charge	INP charge code	<null>	85110014	1970-01-01	2099-12-31	<null>
2000005103	Berlin: Partial inpatient internal medicine	Observation	Inpatient charge	INP charge code	<null>	85110015	1970-01-01	2099-12-31	<null>
2000005104	Berlin: Partial inpatient pediatrics	Observation	Inpatient charge	INP charge code	<null>	85110016	1970-01-01	2099-12-31	<null>
2000005105	Berlin: Day clinic neurology 	Observation	Inpatient charge	INP charge code	<null>	85110017	1970-01-01	2099-12-31	<null>
2000005106	Berlin: Day clinic neuropediatrics (DBZ)	Observation	Inpatient charge	INP charge code	<null>	85110018	1970-01-01	2099-12-31	<null>
2000005107	Berlin: Day clinic for proton therapy for eye tumors	Observation	Inpatient charge	INP charge code	<null>	85110019	1970-01-01	2099-12-31	<null>
2000005108	Brandenburg (partial inpatient, per day)	Observation	Inpatient charge	INP charge Hierarchy	<null>	OMOP6000379	1970-01-01	2099-12-31	<null>
2000005109	Brandenburg: Day clinic geriatrics	Observation	Inpatient charge	INP charge code	<null>	85120001	1970-01-01	2099-12-31	<null>
2000005110	Brandenburg: Day clinic rheumatology 	Observation	Inpatient charge	INP charge code	<null>	85120001	1970-01-01	2099-12-31	<null>
2000005111	Brandenburg: Partial inpatient dialysis	Observation	Inpatient charge	INP charge code	<null>	85120003	1970-01-01	2099-12-31	<null>
2000005112	Brandenburg: Day clinic orthopedics 	Observation	Inpatient charge	INP charge code	<null>	85120005	1970-01-01	2099-12-31	<null>
2000005113	Brandenburg: Day clinic hematology	Observation	Inpatient charge	INP charge code	<null>	85120007	1970-01-01	2099-12-31	<null>
2000005114	Brandenburg: Day clinic pediatrics	Observation	Inpatient charge	INP charge code	<null>	85120008	1970-01-01	2099-12-31	<null>
2000005115	Brandenburg: Partial inpatient chemotherapy/infusion	Observation	Inpatient charge	INP charge code	<null>	85120010	1970-01-01	2099-12-31	<null>
2000005116	Brandenburg: Partial inpatient neurology	Observation	Inpatient charge	INP charge code	<null>	85120011	1970-01-01	2099-12-31	<null>
2000005117	Brandenburg: Partial inpatient endocrinology	Observation	Inpatient charge	INP charge code	<null>	85120012	1970-01-01	2099-12-31	<null>
2000005118	Brandenburg: Partial inpatient angiology	Observation	Inpatient charge	INP charge code	<null>	85120013	1970-01-01	2099-12-31	<null>
2000005119	Brandenburg: Partial inpatient sleep laboratory	Observation	Inpatient charge	INP charge code	<null>	85120014	1970-01-01	2099-12-31	<null>
2000005120	Brandenburg: Partial inpatient gastroscopies in children	Observation	Inpatient charge	INP charge code	<null>	85120015	1970-01-01	2099-12-31	<null>
2000005121	Mecklenburg-Vorpommern (partial inpatient, per day)	Observation	Inpatient charge	INP charge Hierarchy	<null>	OMOP6000380	1970-01-01	2099-12-31	<null>
2000005122	Mecklenburg-Vorpommern: Geriatrics (day clinic)	Observation	Inpatient charge	INP charge code	<null>	85130001	1970-01-01	2099-12-31	<null>
2000005123	Mecklenburg-Vorpommern: Pain therapy (for admissions in 2003)	Observation	Inpatient charge	INP charge code	<null>	85130002	1970-01-01	2099-12-31	<null>
2000005124	Mecklenburg-Vorpommern: Oncology (day clinic)	Observation	Inpatient charge	INP charge code	<null>	85130004	1970-01-01	2099-12-31	<null>
2000005125	Mecklenburg-Vorpommern: Rheumatology (day clinic)	Observation	Inpatient charge	INP charge code	<null>	85130005	1970-01-01	2099-12-31	<null>
2000005126	Mecklenburg-Vorpommern: Pediatric nephrology (day clinic)	Observation	Inpatient charge	INP charge code	<null>	85130007	1970-01-01	2099-12-31	<null>
2000005127	Mecklenburg-Vorpommern: Nuclear medicine (day clinic)	Observation	Inpatient charge	INP charge code	<null>	85130008	1970-01-01	2099-12-31	<null>
2000005128	Mecklenburg-Vorpommern: Partial inpatient chemotherapy	Observation	Inpatient charge	INP charge code	<null>	85130009	1970-01-01	2099-12-31	<null>
2000005129	Mecklenburg-Vorpommern: Pediatrics (day clinic)	Observation	Inpatient charge	INP charge code	<null>	85130010	1970-01-01	2099-12-31	<null>
2000005130	Mecklenburg-Vorpommern: Pneumology (day clinic)	Observation	Inpatient charge	INP charge code	<null>	85130011	1970-01-01	2099-12-31	<null>
2000005131	Mecklenburg-Vorpommern: Gynecology (day clinic)	Observation	Inpatient charge	INP charge code	<null>	85130012	1970-01-01	2099-12-31	<null>
2000005132	Saxony (partial inpatient, per day)	Observation	Inpatient charge	INP charge Hierarchy	<null>	OMOP6000381	1970-01-01	2099-12-31	<null>
2000005133	Saxony: Cardiology fee (for admissions in 2003)	Observation	Inpatient charge	INP charge code	<null>	85140001	1970-01-01	2099-12-31	<null>
2000005134	Saxony: Day clinic pain therapy	Observation	Inpatient charge	INP charge code	<null>	85140002	1970-01-01	2099-12-31	<null>
2000005135	Saxony: Day clinic dermatology	Observation	Inpatient charge	INP charge code	<null>	85140003	1970-01-01	2099-12-31	<null>
2000005136	Saxony: Night clinic polysomnography level 4	Observation	Inpatient charge	INP charge code	<null>	85140004	1970-01-01	2099-12-31	<null>
2000005137	Saxony: Day clinic oncology	Observation	Inpatient charge	INP charge code	<null>	85140005	1970-01-01	2099-12-31	<null>
2000005138	Saxony: Day clinic internal medicine	Observation	Inpatient charge	INP charge code	<null>	85140006	1970-01-01	2099-12-31	<null>
2000005139	Saxony: Day clinic pediatrics	Observation	Inpatient charge	INP charge code	<null>	85140007	1970-01-01	2099-12-31	<null>
2000005140	Saxony: Day clinic pediatric surgery	Observation	Inpatient charge	INP charge code	<null>	85140008	1970-01-01	2099-12-31	<null>
2000005141	Saxony: Day clinic gynecology	Observation	Inpatient charge	INP charge code	<null>	85140009	1970-01-01	2099-12-31	<null>
2000005142	Saxony: Day clinic radiation medicine	Observation	Inpatient charge	INP charge code	<null>	85140010	1970-01-01	2099-12-31	<null>
2000005143	Saxony: Partial inpatient LDL apheresis	Observation	Inpatient charge	INP charge code	<null>	85140011	1970-01-01	2099-12-31	<null>
2000005144	Saxony: Day clinic for cognitive neurology	Observation	Inpatient charge	INP charge code	<null>	85140012	1970-01-01	2099-12-31	<null>
2000005145	Saxony: Partial inpatient hematology	Observation	Inpatient charge	INP charge code	<null>	85140014	1970-01-01	2099-12-31	<null>
2000005146	Saxony: Partial inpatient geriatrics	Observation	Inpatient charge	INP charge code	<null>	85140015	1970-01-01	2099-12-31	<null>
2000005147	Saxony: Day clinic cardiology	Observation	Inpatient charge	INP charge code	<null>	85140016	1970-01-01	2099-12-31	<null>
2000005148	Saxony: Day clinic urology	Observation	Inpatient charge	INP charge code	<null>	85140017	1970-01-01	2099-12-31	<null>
2000005149	Saxony: Day clinic ear, nose, throat medicine	Observation	Inpatient charge	INP charge code	<null>	85140018	1970-01-01	2099-12-31	<null>
2000005150	Saxony: Day clinic neurology 	Observation	Inpatient charge	INP charge code	<null>	85140019	1970-01-01	2099-12-31	<null>
2000005151	Saxony: Ophthalmology partial inpatient	Observation	Inpatient charge	INP charge code	<null>	85140020	1970-01-01	2099-12-31	<null>
2000005152	Saxony-Anhalt (partial inpatient, per day)	Observation	Inpatient charge	INP charge Hierarchy	<null>	OMOP6000382	1970-01-01	2099-12-31	<null>
2000005153	Saxony-Anhalt: Partial inpatient geriatrics	Observation	Inpatient charge	INP charge code	<null>	85150002	1970-01-01	2099-12-31	<null>
2000005154	Saxony-Anhalt: Partial inpatient oncology	Observation	Inpatient charge	INP charge code	<null>	85150003	1970-01-01	2099-12-31	<null>
2000005155	Saxony-Anhalt: Partial inpatient diabetology	Observation	Inpatient charge	INP charge code	<null>	85150004	1970-01-01	2099-12-31	<null>
2000005156	Saxony-Anhalt: Day clinic dermatology	Observation	Inpatient charge	INP charge code	<null>	85150005	1970-01-01	2099-12-31	<null>
2000005157	Saxony-Anhalt: Partial inpatient pediatric oncology	Observation	Inpatient charge	INP charge code	<null>	85150005	1970-01-01	2099-12-31	<null>
2000005158	Saxony-Anhalt: Partial inpatient pediatrics	Observation	Inpatient charge	INP charge code	<null>	85150007	1970-01-01	2099-12-31	<null>
2000005159	Saxony-Anhalt: Day clinic bee and wasp allergosis	Observation	Inpatient charge	INP charge code	<null>	85150008	1970-01-01	2099-12-31	<null>
2000005160	Saxony-Anhalt: Partial inpatient gynecological oncology	Observation	Inpatient charge	INP charge code	<null>	85150010	1970-01-01	2099-12-31	<null>
2000005161	Saxony-Anhalt: Partial inpatient adult hematology and oncology	Observation	Inpatient charge	INP charge code	<null>	85150011	1970-01-01	2099-12-31	<null>
2000005162	Saxony-Anhalt: Partial inpatient pediatric hematology, oncology and metabolic disorders	Observation	Inpatient charge	INP charge code	<null>	85150012	1970-01-01	2099-12-31	<null>
2000005163	Saxony-Anhalt: Partial impatient ear, nose and throat diseases	Observation	Inpatient charge	INP charge code	<null>	85150013	1970-01-01	2099-12-31	<null>
2000005164	Saxony-Anhalt: Partial inpatient urology	Observation	Inpatient charge	INP charge code	<null>	85150014	1970-01-01	2099-12-31	<null>
2000005165	Saxony-Anhalt: Partial inpatient radiotherapy	Observation	Inpatient charge	INP charge code	<null>	85150015	1970-01-01	2099-12-31	<null>
2000005166	Saxony-Anhalt: Partial inpatient orthopedics	Observation	Inpatient charge	INP charge code	<null>	85150016	1970-01-01	2099-12-31	<null>
2000005167	Thuringia (partial inpatient, per day)	Observation	Inpatient charge	INP charge Hierarchy	<null>	OMOP6000383	1970-01-01	2099-12-31	<null>
2000005168	Thuringia: Day clinic geriatrics	Observation	Inpatient charge	INP charge code	<null>	85160001	1970-01-01	2099-12-31	<null>
2000005169	Thuringia: Partial inpatient dermatology	Observation	Inpatient charge	INP charge code	<null>	85160002	1970-01-01	2099-12-31	<null>
2000005170	Thuringia: Partial inpatient orthopedics	Observation	Inpatient charge	INP charge code	<null>	85150003	1970-01-01	2099-12-31	<null>
2000005171	Thuringia: Partial inpatient oncology	Observation	Inpatient charge	INP charge code	<null>	85160004	1970-01-01	2099-12-31	<null>
2000005172	Thuringia: Partial inpatient diabetology	Observation	Inpatient charge	INP charge code	<null>	85160005	1970-01-01	2099-12-31	<null>
2000005173	Thuringia: Partial inpatient neurology	Observation	Inpatient charge	INP charge code	<null>	85160006	1970-01-01	2099-12-31	<null>
2000005174	Thuringia: Partial inpatient ophthalmology	Observation	Inpatient charge	INP charge code	<null>	85160007	1970-01-01	2099-12-31	<null>
2000005175	Thuringia: Partial inpatient general pediatrics	Observation	Inpatient charge	INP charge code	<null>	85160008	1970-01-01	2099-12-31	<null>
2000005176	Thuringia: Partial inpatient radiotherapy	Observation	Inpatient charge	INP charge code	<null>	85160009	1970-01-01	2099-12-31	<null>
2000005177	Thuringia: Partial inpatient spine surgery	Observation	Inpatient charge	INP charge code	<null>	85160010	1970-01-01	2099-12-31	<null>
2000005178	Thuringia: Partial inpatient sleep laboratory	Observation	Inpatient charge	INP charge code	<null>	85160011	1970-01-01	2099-12-31	<null>
2000005179	Special facilities, partial inpatient (day-related)	Observation	Inpatient charge	INP charge Hierarchy	<null>	OMOP6000384	1970-01-01	2099-12-31	<null>
2000005180	Special facility neuropediatric day clinic	Observation	Inpatient charge	INP charge code	<null>	85003001	1970-01-01	2099-12-31	<null>
2000005181	Special facility for day clinic partial inpatient gastroscopies in children	Observation	Inpatient charge	INP charge code	<null>	85003002	1970-01-01	2099-12-31	<null>
2000005182	Palliative medicine	Observation	Inpatient charge	INP charge code	<null>	85003005	1970-01-01	2099-12-31	<null>
2000005183	Special facility for day clinic rheumatism, basic care charge	Observation	Inpatient charge	INP charge code	<null>	85003006	1970-01-01	2099-12-31	<null>
2000005184	Special facility for partial inpatient treatment of severely craniocerebral injured patients	Observation	Inpatient charge	INP charge code	<null>	85003007	1970-01-01	2099-12-31	<null>
2000005185	Special facility for partial inpatient treatment of oncological patients	Observation	Inpatient charge	INP charge code	<null>	85003008	1970-01-01	2099-12-31	<null>
2000005186	Special facility for partial inpatient treatment of multiple sclerosis patients	Observation	Inpatient charge	INP charge code	<null>	85003009	1970-01-01	2099-12-31	<null>
2000005187	Special facility for partial inpatient treatment, dermatology	Observation	Inpatient charge	INP charge code	<null>	85003010	2021-01-01	2099-12-31	<null>
2000005188	Special facility for day clinic, general pediatrics	Observation	Inpatient charge	INP charge code	<null>	85003011	2021-01-01	2099-12-31	<null>
2000005189	Special facilities in Bavaria, partial inpatient (day-related)	Observation	Inpatient charge	INP charge Hierarchy	<null>	OMOP6000385	1970-01-01	2099-12-31	<null>
2000005190	Bavaria: Special facility for partial inpatient treatment of oncological patients	Observation	Inpatient charge	INP charge code	<null>	85093001	1970-01-01	2099-12-31	<null>
2000005191	Bavaria: Special facility for partial inpatient treatment of severely craniocerebral injured patients	Observation	Inpatient charge	INP charge code	<null>	85093002	1970-01-01	2099-12-31	<null>
2000005192	Bavaria: Special facility for partial inpatient treatment of multiple sclerosis patients	Observation	Inpatient charge	INP charge code	<null>	85093003	1970-01-01	2099-12-31	<null>
