concept_id	concept_name	domain_id	vocabulary_id	concept_class_id	standard_concept	concept_code	valid_start_date	valid_end_date	invalid_reason
2000005193	Special facilities, full inpatient (per day)	Observation	Inpatient charge	INP charge Hierarchy	<null>	OMOP6000386	1970-01-01	2099-12-31	<null>
2000005194	Special facility neurology - treatment of Parkinson's disease	Observation	Inpatient charge	INP charge code	<null>	85004001	1970-01-01	2099-12-31	<null>
2000005195	Special facility for multidrug-resistant mycobacterioses	Observation	Inpatient charge	INP charge code	<null>	85004002	1970-01-01	2099-12-31	<null>
2000005196	Special facility for environmental medicine	Observation	Inpatient charge	INP charge code	<null>	85004003	1970-01-01	2099-12-31	<null>
2000005197	Special facility for the treatment of patients before LTX	Observation	Inpatient charge	INP charge code	<null>	85004005	1970-01-01	2099-12-31	<null>
2000005198	Special facility center for microsurgery/replantation	Observation	Inpatient charge	INP charge code	<null>	85004006	1970-01-01	2099-12-31	<null>
2000005199	Special facility trauma center	Observation	Inpatient charge	INP charge code	<null>	85004007	1970-01-01	2099-12-31	<null>
2000005200	Special facility for drug withdrawal	Observation	Inpatient charge	INP charge code	<null>	85004008	1970-01-01	2099-12-31	<null>
2000005201	Special facility for neurology, phase B	Observation	Inpatient charge	INP charge code	<null>	85004009	1970-01-01	2099-12-31	<null>
2000005202	Special facility for neurology, phase B intensive care medicine	Observation	Inpatient charge	INP charge code	<null>	85004010	1970-01-01	2099-12-31	<null>
2000005203	Special facility for palliative care of children	Observation	Inpatient charge	INP charge code	<null>	85004011	1970-01-01	2099-12-31	<null>
2000005204	Special facility for child and adolescent pain therapy	Observation	Inpatient charge	INP charge code	<null>	85004013	1970-01-01	2099-12-31	<null>
2000005205	Special facility palliative medicine	Observation	Inpatient charge	INP charge code	<null>	85004014	1970-01-01	2099-12-31	<null>
2000005206	Special facility for special isolation unit, day charge 2 - suspected category C	Observation	Inpatient charge	INP charge code	<null>	85004015	1970-01-01	2099-12-31	<null>
2000005207	Special facility for special isolation unit, day charge 1- category C	Observation	Inpatient charge	INP charge code	<null>	85004016	1970-01-01	2099-12-31	<null>
2000005208	Special facility for special isolation unit, day charge 3- patients of category B+	Observation	Inpatient charge	INP charge code	<null>	85004017	1970-01-01	2099-12-31	<null>
2000005209	Special facility for isolation unit, basic patient, isolated	Observation	Inpatient charge	INP charge code	<null>	85004018	1970-01-01	2099-12-31	<null>
2000005210	Special facility for isolation unit, intensive care patient, not ventilated	Observation	Inpatient charge	INP charge code	<null>	85004019	1970-01-01	2099-12-31	<null>
2000005211	Special facility for isolation unit, intensive care patient, ventilated	Observation	Inpatient charge	INP charge code	<null>	85004020	1970-01-01	2099-12-31	<null>
2000005212	Special facility for long-term inpatient therapy for the care of severely disabled children and adolescents	Observation	Inpatient charge	INP charge code	<null>	85004021	1970-01-01	2099-12-31	<null>
2000005213	Special facility for neurology (without ventilation)	Observation	Inpatient charge	INP charge code	<null>	85004022	1970-01-01	2099-12-31	<null>
2000005214	Special facility for neurology (with ventilation)	Observation	Inpatient charge	INP charge code	<null>	85004023	1970-01-01	2099-12-31	<null>
2000005215	Special facility for E76A, MDR	Observation	Inpatient charge	INP charge code	<null>	85004024	1970-01-01	2099-12-31	<null>
2000005216	Special facility for E76A, XDR	Observation	Inpatient charge	INP charge code	<null>	85004025	1970-01-01	2099-12-31	<null>
2000005217	Special facility for highly contagious patients, contact person	Observation	Inpatient charge	INP charge code	<null>	85004026	1970-01-01	2099-12-31	<null>
2000005218	Special facility for highly contagious patients level III	Observation	Inpatient charge	INP charge code	<null>	85004027	1970-01-01	2099-12-31	<null>
2000005219	Special facility for highly contagious patients level IV	Observation	Inpatient charge	INP charge code	<null>	85004028	1970-01-01	2099-12-31	<null>
2000005220	Special facility for care charge isolation unit, category I	Observation	Inpatient charge	INP charge code	<null>	85004029	1970-01-01	2099-12-31	<null>
2000005221	Special facility for care charge isolation unit, category II	Observation	Inpatient charge	INP charge code	<null>	85004030	1970-01-01	2099-12-31	<null>
2000005222	Special facility for care charge isolation unit, contact person	Observation	Inpatient charge	INP charge code	<null>	85004031	1970-01-01	2099-12-31	<null>
2000005223	Special facility internal medicine/focus on disability medicine	Observation	Inpatient charge	INP charge code	<null>	85004032	1970-01-01	2099-12-31	<null>
2000005224	Special facility general surgery/focus on disability medicine	Observation	Inpatient charge	INP charge code	<null>	85004033	1970-01-01	2099-12-31	<null>
2000005225	Special facility epilepsy surgery	Observation	Inpatient charge	INP charge code	<null>	85004034	1970-01-01	2099-12-31	<null>
2000005226	Special facility for neurology, focus on epilepsy	Observation	Inpatient charge	INP charge code	<null>	85004035	1970-01-01	2099-12-31	<null>
2000005227	Special facility AIDS/disability focus on disability medicine	Observation	Inpatient charge	INP charge code	<null>	85004036	1970-01-01	2099-12-31	<null>
2000005228	Special facility child neurology and social pediatrics	Observation	Inpatient charge	INP charge code	<null>	85004037	1970-01-01	2099-12-31	<null>
2000005229	Special facility for neonatal intensive care - perinatal center	Observation	Inpatient charge	INP charge code	<null>	85004038	1970-01-01	2099-12-31	<null>
2000005230	Special facility intensive care unit for long-term ventilated children	Observation	Inpatient charge	INP charge code	<null>	85004039	1970-01-01	2099-12-31	<null>
2000005231	Special facility early rehabilitation for long-term ventilated patients	Observation	Inpatient charge	INP charge code	<null>	85004040	1970-01-01	2099-12-31	<null>
2000005232	Special facility pediatrics	Observation	Inpatient charge	INP charge code	<null>	85004041	1970-01-01	2099-12-31	<null>
2000005233	Special facility for severely burned patients	Observation	Inpatient charge	INP charge code	<null>	85004042	1970-01-01	2099-12-31	<null>
2000005234	Special facility severe burned patients	Observation	Inpatient charge	INP charge code	<null>	85004043	1970-01-01	2099-12-31	<null>
2000005235	Special facility for neurology	Observation	Inpatient charge	INP charge code	<null>	85004044	1970-01-01	2099-12-31	<null>
2000005236	Special facility for severe burned patients, children	Observation	Inpatient charge	INP charge code	<null>	85004045	1970-01-01	2099-12-31	<null>
2000005237	Special facility for neurological early rehabilitation, children	Observation	Inpatient charge	INP charge code	<null>	85004046	1970-01-01	2099-12-31	<null>
2000005238	Special facility for psychosomatics, children	Observation	Inpatient charge	INP charge code	<null>	85004047	1970-01-01	2099-12-31	<null>
2000005239	Special facility severely craniocerebral injured persons	Observation	Inpatient charge	INP charge code	<null>	85004048	1970-01-01	2099-12-31	<null>
2000005240	Special facility for epileptology	Observation	Inpatient charge	INP charge code	<null>	85004049	1970-01-01	2099-12-31	<null>
2000005241	Special facility neurological early rehabilitation	Observation	Inpatient charge	INP charge code	<null>	85004050	1970-01-01	2099-12-31	<null>
2000005242	Special facility neuropediatrics	Observation	Inpatient charge	INP charge code	<null>	85004051	1970-01-01	2099-12-31	<null>
2000005243	Special facility for neurological early rehabilitation phase B and treatment of severely craniocerebral injured patients	Observation	Inpatient charge	INP charge code	<null>	85004052	1970-01-01	2099-12-31	<null>
2000005244	Special facility for the full inpatient treatment of oncological patients	Observation	Inpatient charge	INP charge code	<null>	85004053	1970-01-01	2099-12-31	<null>
2000005245	Special facility for severe burned patients, intensive care unit	Observation	Inpatient charge	INP charge code	<null>	85004054	1970-01-01	2099-12-31	<null>
2000005246	Special facility for follow-up treatment of severely burned patients in normal units	Observation	Inpatient charge	INP charge code	<null>	85004055	1970-01-01	2099-12-31	<null>
2000005247	Special facility orthopedics	Observation	Inpatient charge	INP charge code	<null>	85004056	1970-01-01	2099-12-31	<null>
2000005248	Special facility for interdisciplinary pain therapy	Observation	Inpatient charge	INP charge code	<null>	85004057	1970-01-01	2099-12-31	<null>
2000005249	Special facility for full inpatient treatment of multiple sclerosis patients	Observation	Inpatient charge	INP charge code	<null>	85004058	1970-01-01	2099-12-31	<null>
2000005250	Special facility cystic fibrosis	Observation	Inpatient charge	INP charge code	<null>	85004059	1970-01-01	2099-12-31	<null>
2000005251	Special facility dermatology	Observation	Inpatient charge	INP charge code	<null>	85004060	1970-01-01	2099-12-31	<null>
2000005252	Special facility T-KK normal unit	Observation	Inpatient charge	INP charge code	<null>	85004061	1970-01-01	2099-12-31	<null>
2000005253	Special facility T-KKINT intensive care unit	Observation	Inpatient charge	INP charge code	<null>	85004062	1970-01-01	2099-12-31	<null>
2000005254	Special facility epilepsy center	Observation	Inpatient charge	INP charge code	<null>	85004063	1970-01-01	2099-12-31	<null>
2000005255	Special facility for neurological early rehabilitation in phase B (without ventilation)	Observation	Inpatient charge	INP charge code	<null>	85004064	1970-01-01	2099-12-31	<null>
2000005256	Special facility for neurological early rehabilitation in phase B (with ventilation)	Observation	Inpatient charge	INP charge code	<null>	85004065	1970-01-01	2099-12-31	<null>
2000005257	Special facility for neurological treatment	Observation	Inpatient charge	INP charge code	<null>	85004066	1970-01-01	2099-12-31	<null>
2000005258	Special facility for neurological treatment with ventilation	Observation	Inpatient charge	INP charge code	<null>	85004067	1970-01-01	2099-12-31	<null>
2000005259	Special facility for the treatment of paraplegics	Observation	Inpatient charge	INP charge code	<null>	85004068	1970-01-01	2099-12-31	<null>
2000005260	Special facility for neurology, focus on epilepsy (monitoring)	Observation	Inpatient charge	INP charge code	<null>	85004069	1970-01-01	2099-12-31	<null>
2000005261	Special facility for neurology, phase B	Observation	Inpatient charge	INP charge code	<null>	85004070	1970-01-01	2099-12-31	<null>
2000005262	Special facility for neurological early rehabilitation phase B, children	Observation	Inpatient charge	INP charge code	<null>	85004071	1970-01-01	2099-12-31	<null>
2000005263	Special facility for dermatological special treatment	Observation	Inpatient charge	INP charge code	<null>	85004072	1970-01-01	2099-12-31	<null>
2000005264	Special facility for the treatment of chronically ill children, adolescents and young adults with psychosocial disorders	Observation	Inpatient charge	INP charge code	<null>	85004073	1970-01-01	2099-12-31	<null>
2000005265	Special facility for a neonatal satellite ward	Observation	Inpatient charge	INP charge code	<null>	85004079	2020-01-01	2099-12-31	<null>
2000005266	Special facilities in Schleswig-Holstein, full inpatient (per day)	Observation	Inpatient charge	INP charge Hierarchy	<null>	OMOP6000387	1970-01-01	2099-12-31	<null>
2000005267	Schleswig-Holstein: Special facility for palliative medicine	Observation	Inpatient charge	INP charge code	<null>	85014001	1970-01-01	2099-12-31	<null>
2000005268	Schleswig-Holstein: Special facility for pediatrics	Observation	Inpatient charge	INP charge code	<null>	85014003	1970-01-01	2099-12-31	<null>
2000005269	Special facilities in Hamburg, full inpatient (per day)	Observation	Inpatient charge	INP charge Hierarchy	<null>	OMOP6000388	1970-01-01	2099-12-31	<null>
2000005270	Hamburg: Special facility for severely burned patients	Observation	Inpatient charge	INP charge code	<null>	85024001	1970-01-01	2099-12-31	<null>
2000005271	Hamburg: Special facility for severe burned patients 1st phase	Observation	Inpatient charge	INP charge code	<null>	85024002	1970-01-01	2099-12-31	<null>
2000005272	Hamburg: Special facility for severe burned patients 2nd phase	Observation	Inpatient charge	INP charge code	<null>	85024003	1970-01-01	2099-12-31	<null>
2000005273	Hamburg: Special facility for high-profile paraplegics/respiratory paraplegics	Observation	Inpatient charge	INP charge code	<null>	85024004	1970-01-01	2099-12-31	<null>
2000005274	Hamburg: Special facility for other paraplegia	Observation	Inpatient charge	INP charge code	<null>	85024005	1970-01-01	2099-12-31	<null>
2000005275	Hamburg: Special facility for hand surgery	Observation	Inpatient charge	INP charge code	<null>	85024006	1970-01-01	2099-12-31	<null>
2000005276	Special facilities in North Rhine-Westphalia, full inpatient (per day)	Observation	Inpatient charge	INP charge Hierarchy	<null>	OMOP6000389	1970-01-01	2099-12-31	<null>
2000005277	North Rhine-Westphalia: Special facility internal medicine/focus on medicine for the disabled	Observation	Inpatient charge	INP charge code	<null>	85054002	1970-01-01	2099-12-31	<null>
2000005278	North Rhine-Westphalia: Special facility surgery/focus on medicine for the disabled	Observation	Inpatient charge	INP charge code	<null>	85054003	1970-01-01	2099-12-31	<null>
2000005279	North Rhine-Westphalia: Special facility epilepsy surgery	Observation	Inpatient charge	INP charge code	<null>	85054004	1970-01-01	2099-12-31	<null>
2000005280	North Rhine-Westphalia: Special facility neurology/focus on epilepsy medicine	Observation	Inpatient charge	INP charge code	<null>	85054005	1970-01-01	2099-12-31	<null>
2000005281	North Rhine-Westphalia: Special facility AIDS/focus on medicine for the disabled	Observation	Inpatient charge	INP charge code	<null>	85054006	1970-01-01	2099-12-31	<null>
2000005282	North Rhine-Westphalia: Special facility for child neurology and social pediatrics	Observation	Inpatient charge	INP charge code	<null>	85054007	1970-01-01	2099-12-31	<null>
2000005283	North Rhine-Westphalia: Special facility for neonatal intensive care, perinatal center	Observation	Inpatient charge	INP charge code	<null>	85054008	1970-01-01	2099-12-31	<null>
2000005284	North Rhine-Westphalia: Special facility intensive care unit for long-term ventilated children	Observation	Inpatient charge	INP charge code	<null>	85054009	1970-01-01	2099-12-31	<null>
2000005285	North Rhine-Westphalia: Special facility early rehabilitation for long-term ventilated patients	Observation	Inpatient charge	INP charge code	<null>	85054010	1970-01-01	2099-12-31	<null>
2000005286	North Rhine-Westphalia: Special facility for the treatment of patients with multiple sclerosis or Parkinson's disease	Observation	Inpatient charge	INP charge code	<null>	85054011	1970-01-01	2099-12-31	<null>
2000005287	North Rhine-Westphalia: Special facility for severe burned patients	Observation	Inpatient charge	INP charge code	<null>	85054012	1970-01-01	2099-12-31	<null>
2000005288	North Rhine-Westphalia: Special facility for spinal cord injury patients	Observation	Inpatient charge	INP charge code	<null>	85054013	1970-01-01	2099-12-31	<null>
2000005289	North Rhine-Westphalia: Special facility for palliative medicine	Observation	Inpatient charge	INP charge code	<null>	85054014	1970-01-01	2099-12-31	<null>
2000005290	Special facilities in Hesse, full inpatient (per day)	Observation	Inpatient charge	INP charge Hierarchy	<null>	OMOP6000390	1970-01-01	2099-12-31	<null>
2000005291	Hesse: Special facility for the treatment of severe burned patients	Observation	Inpatient charge	INP charge code	<null>	85064001	1970-01-01	2099-12-31	<null>
2000005292	Hesse: Special facility for day-related full inpatient services in phoniatrics (clinic for voice and speech disorders)	Observation	Inpatient charge	INP charge code	<null>	85064002	1970-01-01	2099-12-31	<null>
2000005293	Hesse: Special facility for day-related full inpatient services in neurology	Observation	Inpatient charge	INP charge code	<null>	85064003	1970-01-01	2099-12-31	<null>
2000005294	Hesse: Special facility for palliative care	Observation	Inpatient charge	INP charge code	<null>	85064005	1970-01-01	2099-12-31	<null>
2000005295	Hesse: Special facility for severe burned patients, children	Observation	Inpatient charge	INP charge code	<null>	85064006	1970-01-01	2099-12-31	<null>
2000005296	Hesse: Special facility for neurological early rehabilitation, children	Observation	Inpatient charge	INP charge code	<null>	85064007	1970-01-01	2099-12-31	<null>
2000005297	Hesse: Special facility for psychosomatic medicine, children	Observation	Inpatient charge	INP charge code	<null>	85064008	1970-01-01	2099-12-31	<null>
2000005298	Hesse: Special facility for neurology phase B	Observation	Inpatient charge	INP charge code	<null>	85064009	1970-01-01	2099-12-31	<null>
2000005299	Hesse: Special facility for neurology phase B, intensive	Observation	Inpatient charge	INP charge code	<null>	85064010	1970-01-01	2099-12-31	<null>
2000005300	Special facilities in Rhineland-Palatinate, full inpatient (per day)	Observation	Inpatient charge	INP charge Hierarchy	<null>	OMOP6000391	1970-01-01	2099-12-31	<null>
2000005301	Rhineland-Palatinate: Special facility for the treatment of severely craniocerebral injured patients	Observation	Inpatient charge	INP charge code	<null>	85074003	1970-01-01	2099-12-31	<null>
2000005302	Rhineland-Palatinate: Special facility for severe burned patients	Observation	Inpatient charge	INP charge code	<null>	85074005	1970-01-01	2099-12-31	<null>
2000005303	Rhineland-Palatinate: Special facility full inpatient pain therapy	Observation	Inpatient charge	INP charge code	<null>	85074006	1970-01-01	2099-12-31	<null>
2000005304	Rhineland-Palatinate: Special facility neurology, phase A	Observation	Inpatient charge	INP charge code	<null>	85074007	1970-01-01	2099-12-31	<null>
2000005305	Rhineland-Palatinate: Special facility neurology, phase B	Observation	Inpatient charge	INP charge code	<null>	85074008	1970-01-01	2099-12-31	<null>
2000005306	Rhineland-Palatinate: Special facility neurological early rehabilitation	Observation	Inpatient charge	INP charge code	<null>	85074009	1970-01-01	2099-12-31	<null>
2000005307	Rhineland-Palatinate: Special facility for palliative medicine	Observation	Inpatient charge	INP charge code	<null>	85074010	1970-01-01	2099-12-31	<null>
2000005308	Rhineland-Palatinate: Special facility child neurology	Observation	Inpatient charge	INP charge code	<null>	85074011	1970-01-01	2099-12-31	<null>
2000005309	Special facilities in Baden-Württemberg, full inpatient (per day)	Observation	Inpatient charge	INP charge Hierarchy	<null>	OMOP6000392	1970-01-01	2099-12-31	<null>
2000005358	Special facilities in Saxony, full inpatient (per day)	Observation	Inpatient charge	INP charge Hierarchy	<null>	OMOP6000397	1970-01-01	2099-12-31	<null>
2000005310	Baden-Württemberg: Special facility for neurological early rehabilitation, phase B, and treatment of severely craniocerebral injured patients	Observation	Inpatient charge	INP charge code	<null>	85084001	1970-01-01	2099-12-31	<null>
2000005311	Baden-Württemberg: Special facility for epileptology	Observation	Inpatient charge	INP charge code	<null>	85084002	1970-01-01	2099-12-31	<null>
2000005312	Baden-Württemberg: Special facility for palliative medicine	Observation	Inpatient charge	INP charge code	<null>	85084004	1970-01-01	2099-12-31	<null>
2000005313	Baden-Württemberg: Special facility for neurology	Observation	Inpatient charge	INP charge code	<null>	85084005	1970-01-01	2099-12-31	<null>
2000005314	Baden-Württemberg: Special facility for severe burned patients	Observation	Inpatient charge	INP charge code	<null>	85084006	1970-01-01	2099-12-31	<null>
2000005315	Baden-Württemberg: Special facility neuropediatrics	Observation	Inpatient charge	INP charge code	<null>	85084007	1970-01-01	2099-12-31	<null>
2000005316	Special facilities in Bavaria, full inpatient (per day)	Observation	Inpatient charge	INP charge Hierarchy	<null>	OMOP6000393	1970-01-01	2099-12-31	<null>
2000005317	Bavaria: Special facility for full inpatient treatment of oncological patients	Observation	Inpatient charge	INP charge code	<null>	85094001	1970-01-01	2099-12-31	<null>
2000005318	Bavaria: Special facility for severely craniocerebral injured persons	Observation	Inpatient charge	INP charge code	<null>	85094002	1970-01-01	2099-12-31	<null>
2000005319	Bavaria: Special facility for severely burned patients, intensive care unit	Observation	Inpatient charge	INP charge code	<null>	85094003	1970-01-01	2099-12-31	<null>
2000005320	Bavaria: Special facility for follow-up treatment of severely burned patients in normal units	Observation	Inpatient charge	INP charge code	<null>	85094004	1970-01-01	2099-12-31	<null>
2000005321	Bavaria: Special facility internal medicine	Observation	Inpatient charge	INP charge code	<null>	85094006	1970-01-01	2099-12-31	<null>
2000005322	Bavaria: Special facility orthopedics	Observation	Inpatient charge	INP charge code	<null>	85094007	1970-01-01	2099-12-31	<null>
2000005323	Bavaria: Special facility internal medicine/focus on naturopathy	Observation	Inpatient charge	INP charge code	<null>	85094008	1970-01-01	2099-12-31	<null>
2000005324	Bavaria: Special facility for interdisciplinary pain therapy	Observation	Inpatient charge	INP charge code	<null>	85094009	1970-01-01	2099-12-31	<null>
2000005325	Bavaria: Special facility for the treatment of paraplegics	Observation	Inpatient charge	INP charge code	<null>	85094010	1970-01-01	2099-12-31	<null>
2000005326	Bavaria: Special facility for the treatment of paraplegics in intensive care units	Observation	Inpatient charge	INP charge code	<null>	85094011	1970-01-01	2099-12-31	<null>
2000005327	Bavaria: Special facility for severely craniocerebral injured, intensive care unit	Observation	Inpatient charge	INP charge code	<null>	85094012	1970-01-01	2099-12-31	<null>
2000005328	Bavaria: Special facility for full inpatient treatment of multiple sclerosis patients	Observation	Inpatient charge	INP charge code	<null>	85094013	1970-01-01	2099-12-31	<null>
2000005329	Bavaria: Special facility for palliative medicine	Observation	Inpatient charge	INP charge code	<null>	85094014	1970-01-01	2099-12-31	<null>
2000005330	Bavaria: Special facility pediatrics	Observation	Inpatient charge	INP charge code	<null>	85094015	1970-01-01	2099-12-31	<null>
2000005331	Bavaria: Special facility hyperthermia	Observation	Inpatient charge	INP charge code	<null>	85094017	1970-01-01	2099-12-31	<null>
2000005332	Bavaria: Special facility pediatric cardiac surgery and cardiology	Observation	Inpatient charge	INP charge code	<null>	85094020	1970-01-01	2099-12-31	<null>
2000005333	Bavaria: Special facility cystic fibrosis	Observation	Inpatient charge	INP charge code	<null>	85094021	1970-01-01	2099-12-31	<null>
2000005334	Bavaria: Special facility dermatology	Observation	Inpatient charge	INP charge code	<null>	85094027	1970-01-01	2099-12-31	<null>
2000005335	Bavaria: Special facility T-KK normal unit	Observation	Inpatient charge	INP charge code	<null>	85094028	1970-01-01	2099-12-31	<null>
2000005336	Bavaria: Special facility T-KKINT intensive care unit	Observation	Inpatient charge	INP charge code	<null>	85094029	1970-01-01	2099-12-31	<null>
2000005337	Bavaria: Special facility spine surgery for children and adolescents	Observation	Inpatient charge	INP charge code	<null>	85094030	1970-01-01	2099-12-31	<null>
2000005338	Bavaria: Special facility neuropediatrics	Observation	Inpatient charge	INP charge code	<null>	85094031	1970-01-01	2099-12-31	<null>
2000005339	Bavaria: Special facility epilepsy surgery	Observation	Inpatient charge	INP charge code	<null>	85094032	1970-01-01	2099-12-31	<null>
2000005340	Bavaria: Special facility acute neurology	Observation	Inpatient charge	INP charge code	<null>	85094033	1970-01-01	2099-12-31	<null>
2000005341	Bavaria: Special facility for pediatric and adolescent rheumatology	Observation	Inpatient charge	INP charge code	<null>	85094034	1970-01-01	2099-12-31	<null>
2000005342	Bavaria: Special facility for severely craniocerebral injured patients, complex multimodular spasticity therapy	Observation	Inpatient charge	INP charge code	<null>	85094035	1970-01-01	2099-12-31	<null>
2000005343	Bavaria: Special facility pediatrics	Observation	Inpatient charge	INP charge code	<null>	85094037	1970-01-01	2099-12-31	<null>
2000005344	Bavaria: Special facility pediatric oncology	Observation	Inpatient charge	INP charge code	<null>	85094039	1970-01-01	2099-12-31	<null>
2000005345	Bavaria: Special facility epilepsy center	Observation	Inpatient charge	INP charge code	<null>	85094040	1970-01-01	2099-12-31	<null>
2000005346	Bavaria: Special facility acute neurology with focus on Parkinson's disease and multiple sclerosis	Observation	Inpatient charge	INP charge code	<null>	85094041	1970-01-01	2099-12-31	<null>
2000005347	Special facilities in Berlin, full inpatient (per day)	Observation	Inpatient charge	INP charge Hierarchy	<null>	OMOP6000394	1970-01-01	2099-12-31	<null>
2000005348	Berlin: Special facility for palliative medicine	Observation	Inpatient charge	INP charge code	<null>	84114001	1970-01-01	2099-12-31	<null>
2000005349	Special facilities in Brandenburg, full inpatient (per day)	Observation	Inpatient charge	INP charge Hierarchy	<null>	OMOP6000395	1970-01-01	2099-12-31	<null>
